is_in_other_df,body
1,Wow. Throwback to when Senator Barack Obama agreed with @realDonaldTrump on immigration! RT this so your friends see this! https://t.co/njiHBonHlM
1,"⚡️When I use the terms ""foreign migrants"" or ""Israli migrant army"" or ""migrant settlers""

I'm using the correct historical term, it's not a joke. https://t.co/LJ2IuLQd7T"
1,"Elon Musk says the Biden Administration is actively aiding illegal immigration?

Do you agree? https://t.co/5o3OcS5h00"
1,"""New York city is legit becoming the worst nightmare""

""These gangs are brutally beating up people""

""And yet mayor Adams is still saying you should vote for Biden""

""This one illegal migrant girl has been arrested 8 times""

""She was let go with no bail""

What the heII is going… https://t.co/J7vQzIb8Xy"
1,"Chicago Is No Longer Asleep 👏🏻 Resident Destroys Committee On Immigrant &amp; Refugee Rights 

“We have an administration that is run by criminals who hate America”

“I'd like to start off with something Edward Snowden, a whistleblower once said. He said, when exposing a crime is… https://t.co/dmKQG1VMR6"
1,"Strange foreign men roaming through Dublin in groups. 

If you don't start speaking out against immigration now, your kids and grandkids will curse you. 

#IrelandisFull https://t.co/6STWMC8NiR"
1,"We're back with our favourite customs agent. 

If this man was put in charge of all Immigration into Ireland, there'd be nobody coming in! 

Legend. https://t.co/QJmvIUBXMi"
1,"Canvassing in #Letterkenny and #Ballybofey,  Co #Donegal &amp; speaking to local people about deeply damaging impact of EU Migration Pact. People have right to be concerned. Thankfully, more people speaking up on issue of immigration and housing. https://t.co/0IZeH0LaVj"
1,"THE CORRUPT COLOMBIAN IMMIGRANT JUDGE JUAN MERCHAN JUST GAGGED PRESIDENT TRUMP! 

THIS IMMIGRANT DOESN’T KNOW WHAT THE FIRST AMENDMENT IS! 

SHARE THIS SINCE PRESIDENT TRUMP CAN’T !!! https://t.co/xb3eFxFPAJ"
1,MIGRANT  FEMALE NY USING BASEBALL BAT https://t.co/zSZP7JQVZs
1,"NYC Migrant Crisis👇🏻

This right here is the epicenter of the migrant crisis in NYC. It’s the Roosevelt hotel where they are being bussed to from Texas &amp; Florida. The situation is actually much worse than the media makes it out to be. They’re making midtown NYC look like Honduras https://t.co/5EvR8UBPp6"
1,Always protect your woman.  This will be our reality as more and more migrants flood our homelands.  #Immigration #IrelandisFull #Diversity #BorderCrisis https://t.co/njT3LKBHoA
1,"In memory of Pamela, a beautiful Italian girl. She was only 18 years old when an illegal African immigrant kidnapped her, tortured her, kiIIled her, chopped up her body, cannibaIized her, locked her in a suitcase and threw her on the street. In a wiretap, the kiIIer is heard… https://t.co/yjQiuIv6sX"
1,People loved Roosevelt so much that an illegal Latvian immigrant risked his immigration status to destroy a mural mocking him and his administration. https://t.co/3kNzRdejmn
1,Cocky Illegal Immigrant Gets What He Deserves https://t.co/94kXPTEKMr
1,"@RadioGenoa Homeowner in Barcelona asks the illegal African immigrant to leave the occupied house but he refuses and takes a hammer: ""It's my house now!"" https://t.co/uHsOyTKLsh"
1,North African immigrant makes his son urinate on an Italian police car out of contempt for Italy while his compatriots film and laugh. We hope that with this video they can be traced and sent back to where they came from. https://t.co/7qQykItl9E
1,"Russia is conducting raids on dorms and apartment complexes known to house illegal immigrants to conduct mass deportations in response to the recent attack in Moscow, which claimed the lives of over 140 people. 

According to migrant rights NGOs, Russia has processed hundreds of… https://t.co/Dmc6BYosXb"
1,Wales: The Welsh Refugee Council is using 12 yr old girls in ads meant to entice migrant men to come to Wales. The refugee council is a far left group. https://t.co/dWn6ASoaqo
1,"Immigration is why your rent is so high.

Unlimited demand is a wet dream for landlords and developers. 

You're competing with 1.2 million foreigners for housing.

That's why you'll never own a home. https://t.co/oY4xpobSVU"
1,Massive support for a campaign against the opening of an illegal migrant Centre at the Ocean Heights Care Home. People are fed up by the established powers that be and are ready for real change! More updates to come. #ReformUK https://t.co/qEgkq9vjVi
1,"I find this video symbolic of white nations. We are stronger than other races, but when we become outnumbered, we lose our power.  Only when unified can we expel the neocolonizers and create a future for white children.  Demographics are destiny. #Diversity #Immigration https://t.co/UtM1xx9ini"
1,"Final part of interview with Callum Smiles in which I look at the implications of Ireland's ruinous immigration policy, the fact that we are close to midnight in terms of likely social breakdown and how we can reverse the self destructive course we have set. https://t.co/csg5mEE17H"
1,🇮🇪😡We must demand a Referendum on the EU Migration and Asylum Pact as it is a direct attack on our Constitutional Sovereignty. https://t.co/p5q4rRF96F
1,Ireland must OPT OUT from the EU migration pact. #Irelandisfull #Irishfreedom 🇮🇪 https://t.co/A266PMttiu
1,STOP ILLEGAL IMMIGRATION @29 May 2024 https://t.co/Y3vp28Ikng
1,"WATCH: DeSantis grills NBC for story that residents are ""fleeing"" Florida in droves

""Trying to say people are leaving Florida in droves. And then they had to admit in the article we were #1 for net in migration in the year that they're talking about!"" https://t.co/kn12eqBQJg"
1,"A video which looks at the global elite &amp; how the biggest buttress to their plans are us, the working-classes. 

Forced to flee to the suburbs or rural areas as inner cities become immigrant ghettos, who wait on them hand &amp; foot in the service industries &amp; cheap manual labour.… https://t.co/7RDzCvvlXR"
1,"THE BOERS' MIGRATION MOVEMENT IN JEOPARDY

During the period between Potgieter's departure and Gerrit Maritz's trek from the Cape in September 1836, the Boers' migration movement reached a critical turning point. Few Boers were ready to follow Potgieter, and a lack of action… https://t.co/FgocAxd08k"
1,"Where did all the money go Gavin?

How are your open borders and illegal immigrant incentive programs going?"
1,"UNREAL! Ecuador migrant says says “ The U.S. has collected all the garbage from other countries !” 
#DemocratsAreDestroyingAmerica #EasterSunday https://t.co/XNsEcbmVsd"
1,U.S. Citizenship Services just introduced a third gender to its immigration forms: https://t.co/vkrr9llv4P
1,"WATCH: Hamiltonians speak out against the Liberal-NDP's 23% carbon tax increase while MPs get a pay raise and Canadians face a housing, immigration and cost of living crisis.

""Just step down"" one demonstrator says on the overpass.

Sign the petition: https://t.co/fK4ZaxDGPj https://t.co/rAH60KGC4H"
1,"Repeat after me. 

Legal immigration is a bigger problem than illegal immigration. https://t.co/000bovtdQU"
1,"FRANCE 

A 34 year old Muslim migrant from Senegal has been arrested after threatening to burn down Notre Dame de la Voie church in Athis Mons.

The would be terrorist entered the church and told a parishioner of his plans to attack the building. https://t.co/MlvjS4uZdG"
1,"The difference between 'Refugees' and 'Migrants'.
The only reason we fled thousands of miles leaving behind our beloved country and loved ones is in fear of persecution and seeking safety. A Migrant refers to someone who had has voluntarily chosen to leave their home country to… https://t.co/DbjKVxyexJ"
1,"Eric Weinstein lays out how immigration is a Ponzi scheme. ""And the secret weapon is immigration. And the great part about immigration is it is as an invidious tool for one generation to screw another generation with. . . It's just pushing out the supply curve on labor and wages.… https://t.co/UAUpHW2XC2"
1,A immigrant in North Carolina said this https://t.co/HNRhg10RDX
1,"A Haitian illegal migrant who confessed to s—xually abusing a 10-year-old child told police in Broward County, Fla. that he should have asked for a lawyer before incriminating himself. Nivenson Sarazin has been charged with five counts of battery contact with bodily fluids, five… https://t.co/C0cCROjsHp"
1,"Mass immigration is bad economics. We're not getting the best of the best. Quite the opposite 
https://t.co/XGDh2Eh9rs https://t.co/ikiByoXq6u"
1,"Had myself and @JamesBreeden not been down at the border to capture the El Paso migrant riot, I’m not sure what would’ve happened.

Now we’re hearing some of the accused migrants are being set free. https://t.co/Uiz7MWaEvk"
1,"⚡️The Israeli migrant soldiers are scared of flags because of this historic ambush on the borders of #Gaza 

The Flag Ambush https://t.co/oPbGmKnqaR"
1,"Dublin, Ireland🇮🇪

🤡Just an immigrant brawl in the mall https://t.co/JSH5TeylXg"
1,Why are we letting foreigners rule over us? #Immigration #London #Ireland https://t.co/0Xz3Vr0NOX
1,"So listen to this dude...

He spells out how the government will pay per migrant to have them housed in homes.  BlackRock bought a TON of properties so it figures that they would take government money...  Nice little scam there.

Then there are the people that take them in for… https://t.co/ZHEwT07155"
1,"The issues surrounding the border are indeed critical, and it's clear that those of us living in border communities, like myself in Gadsden, Arizona, offer unique perspectives on the intricacies of immigration. Having lived in front of the border for over 30 years, combined with… https://t.co/ZNyvB3SvGt"
1,Have a listen to Don. He's Irish. He has a Youtube channel called Don's travels And rants. He travels and gives his opinion on places in Ireland. Let me know what you think of his opinion on the immigration situation in Ireland. I will post a link to his YT channel in replies 👇 https://t.co/xVLcZr9OhE
1,"“IT’S NOT IMMIGRATION, IT’S SLAVE TRADE” ☞ LISTEN TO OUR SHERIFFS

In many ways a County Sheriff has more authority than POTUS and many other branches of the federal government. They know more about what is going on locally which, in reality, is the most important thing. ✪… https://t.co/kU5gyBvAYw"
1,"Milan, Italy🇮🇹

🚨An immigrant harassed a girl on the train

❗️This time the Italians reacted to protect the girl https://t.co/wf5kt94AK7"
1,"Funny how Israel is not in need of mass third world immigration, unlike all white countries. https://t.co/378yEFr6Z5"
1,"“The bloated NYPD budget could fund ALL migrant housing and only have to cut overtime in the subway”

- spotted in the East Village across from Tompkins Square Park &amp; the migrant ‘reticketing center’ https://t.co/2aWPdFv8ri"
1,North African immigrant in Milan harassed girls on train but finds the wrong Italians. https://t.co/CGcW11AqFk
1,"Do you think this dance will help discourage migrant men attacking women in Finland? 

 https://t.co/wfmqURhnRy"
1,"🚨ALBANESE GOVERNMENT ANNOUNCES $5.22M FUNDING FOR COMMUNITIES AFFECTED BY THE MIDDLE EAST CRISIS!
In a statement from immigration minister Andrew Giles, he said the funding is part of a $25m commitment to support Palestinian, Arab and Muslim communities.
Statement reads ""It will… https://t.co/cPtiYqnE1R"
1,"Give Australians a Say on Immigration!
Australians have never been asked what they think is a fair amount of #immigration. The Lib-Lab parties both advocate for high immigration and because many different issues go towards deciding which party to vote for on polling day,… https://t.co/ZZzwJBzSSi"
1,"Democrats create Jobs.
Republicans create chaos.

There are no policies for the Average American.

The only thing they run on is Immigration, but refuses to solve it. 

I am going with the party who’s working for Americans.
#ProudBlue
#VoteBlueToSaveAmerica https://t.co/jgGClKBxut"
1,"Mutahar is one the greatest examples of how mass migration is a fundamentally flawed idea.

Even the ones who aren’t violent barbarians are still stupid beyond measure."
1,"Canada is falling, mass immigration must be stopped.

 https://t.co/Gg83EpFmb0"
1,"""Immigration is ruthless towards Sweeden: they have BETRAYED the Swedish people. If I had a daughter I would follow her with a shotgun""

Swedish cities are now unrecognizable, many neighborhoods are Islamic NO-GO areas.

Open borders basically destroys a country because you can… https://t.co/CUGrGZlxh2"
1,"The EU migration pact is being sold in the run in to the rlections as an effort to curb immigration into Ireland. In fact it involves, yet again, a ceding of sovereignty and gives an utterly dishonest government an excuse to inflict even more damage on the wounded Nation of… https://t.co/neXRlYcomC"
1,"Just in:  Gov. Newsom just signed a law, mandating that every California resident that owns a home, must house an illegal immigrant from the southern border for no less than 30 days.  Once housed, that person will be registered as a democrat in this coming presidential election. https://t.co/arHChJmja1"
1,Zero immigration for people not of European descent.
1,EU Migration Pact is a huge loss of sovereignty and security. And it'll cost us a fortune. The political establishment  needs a good shake up come European and local election time. They need to hear a clear message.... we've had enough uncontrolled immigration thanks. https://t.co/ICs7WU1OUv
1,"We must demand a Referendum on the EU Migration and Asylum Pact as it is a direct attack on our Constitutional Sovereignty.

It was announced this week that Minister McEntee has secured approval from Government to opt-in to measures of the EU Pact on Migration and Asylum YET… https://t.co/MiDEYehaKn"
1,"Just paid the immigration entry fee into El Salvador using lightning. 

F*cking surreal."
1,Illegal immigrants still come in their thousands. This will be the end of Rishi Sunak. The total failure to control both legal &amp; illegal immigration will lose the Tories the next election. Since 2010 Tories promised low immigration &amp; it has gone up &amp; up https://t.co/ZIYTmN238q
1,"More migrant men in Ireland caught filming children. Sounds like it could be human trafficking.

This is what the government are bringing in all over the country. Ireland is becoming extremely dangerous.

#IrelandIsFull
#IrelandOptsOut https://t.co/vlggCPgxNZ"
1,"So I’m hearing that US immigration is allowing illegal immigrants to put “x” as a gender option. 

Does know one care about the women, children and vulnerable in this country anymore? 

I would like to share this experience with you. https://t.co/cENZmXqr8R"
1,Mayorkas brags about all the Trump Immigration policies Biden rescinded! Make no mistake this is Biden’s Border crisis! https://t.co/OAA0DPNS8a
1,"🚨 BREAKING: Channel migrant arrivals to the UK have surged by 43% in 2024.

📺 Freeview 236, Sky 512, Virgin 604
🖥 GB News on YouTube https://t.co/Wa58gYGZwF https://t.co/T9wFqXC00f"
1,"‘This is getting sinister now. People are being told their houses will be forcefully purchased to give to asylum seekers, which essentially tears up property rights in Britain.’

Suzanne Evans comments on Sunak's homeless clamp down, and the possibility of migrant tent-cities. https://t.co/BBXOROMGuU"
1,"Asylum seekers hotels full
Social housing full
Migrant barges scampton full
Tent City here We come thanks to immigration and over 5,000 people flooded in so far to the United Kingdom thanks to the conservative government https://t.co/bxWAX6aZZ1"
1,The New Immigrant Crime League https://t.co/z4my9Pj9Jh
1,"Dear African Migrant Worker,

Wealth and prosperity is NOT a destination but a constant climb. You keep trying to go up or else you will slide slowly down. Never lose your hustle mentality and spirit. Do things on the side. Find better work and better locations to prosper. https://t.co/bzE3hnElT5"
1,immigration is truly one of the most powerfully destructive forces that's why it's being forced on white people.
1,BREAKING: Idaho House has passed a bill to give law enforcement powers to check immigration status while a magistrate judge would be able to return illegal immigrants to their country of origin.
1,"""Watch it."" - Fireworks on House floor as Rep. Mickelsen continues to defend illegal migration during debate on H753 that would make it a crime to be in Idaho illegally. https://t.co/JK4kFDYWDB"
1,"From grooming gangs to the stagnation of British wages uncontrolled mass migration into our country has been a disaster for our people

We @Homeland_Party believe that the only route forward for the British is to have an absolute zero policy for immigration into Britain https://t.co/chWY8Cx5mW"
1,"Some in the Sudanese diaspora are demanding that Canada fast-track their relatives’ immigration applications amid the civil war in Sudan.

Canadians, what do you think? https://t.co/NiUiNWvML0"
1,"In Spain, an illegal immigrant takes an elderly woman hostage.

Cops arrive, bang bang bang 💥 

Crowd all cheers 🙌🏼 🇪🇸 https://t.co/CwA3Cj68pi"
1,"What bit don't the @Conservatives get? Their voters rejected @RishiSunak  @Jeremy_Hunt, remoan loving @David_Cameron yet those 3 are now running the country into the ground. In their arrogance they ignored our wishes. They've forced on us mass immigration, they must be destroyed"
1,They’re not giving up yet here in Juarez even though Texas forces are now firing pepper balls to break up the immigrant banzai charges through the Texas fortifications at gate 36. DPS over the last couple days arrested and charged 221 for rioting and criminal mischief. https://t.co/SuGeMx0RqD
1,What she borrow from yall? Country music is a Black American creation. Stfu forever with this ellis island immigrant babble.
1,"“Governor, your illegal immigration incentives got a young woman killed this week. What can we do to distract from it?”

- Whitmer’s Handlers 

“Cash for babies.” 

- Whitmer https://t.co/U0euSnS5sS"
1,Happy brown middle eastern radical left unhoused migrant refugee who offered free food and healthcare to the poor coming back from the dead day to those who celebrate https://t.co/kKcldg2HyM
1,"🚨Must Listen 👇 @danobrien20  on @RadioBrendanRTE talking sense on the issue of #immigration and the fact that ordinary people raising concerns were called ‘far right’ - someday I hope there will be an apology 🇮🇪

 https://t.co/DQgo35ugMV"
1,The EU Migration and Asylum Pact has not yet been approved by both Houses of the Oireachtas who must vote on whether to opt-in to the provisions. The political establishment are trying desperately to sell the Pact to the Irish people when the reality is they could have done all… https://t.co/cDWpMHVM2y
1,The truth about legislation for legal immigration. Bill Maher regrets asking about the facts of bipartisan bill shredded by Biden on open borders. https://t.co/2iXRYLKIHj
1,"U.S. Citizenship and Immigration Services introduces ""a third gender option” https://t.co/dK3r81fg98"
1,"It always sounds hyperbolic to say “we’re nearing our end”

But honestly, think about it.

-You’re xenophobic to simply want orderly immigration

-You’re racist for NOT seeing color

-You’re sexist for protecting women’s sports

-You’re a bad parent for NOT giving your child a…"
1,"Haitian illegal immigrant confesses to sexual abuse of 10-year-old Florida girl

https://t.co/yyU7ufiwsF

https://t.co/yyU7ufiwsF"
1,Mexican immigration officer explains how some defeat the Texas fortifications but I don’t see how that many - the ones I saw lined up for fast-release federal processing - got through this way https://t.co/TOMJRsRK0i
1,"Migrant chases woman into her apartment on Parnell Street this morning.
#GetThemOut https://t.co/9vn9nxwwB0"
1,"ANOTHER MASSIVE LIE. 

Here’s the full UNEDITED segment on immigration policy from Trump’s interview with Dan O’Donnell where Trump clearly talks about deporting violent criminals and gang members.

Trump also states “they’re coming from all over the world not just South America” https://t.co/M4FnseIyKi"
1,Mass immigration. https://t.co/IpTYbAdEgh
1,"For the second time in a row, Indonesian migrant workers took the stage at @megaportfest, one of Taiwan's highest-profile independent music festivals in the southern city of Kaohsiung. The punk band Southern Riot sings about human rights and labor issues migrants face in Taiwan. https://t.co/dVV72FBPo2"
1,The current priority of U.S. Citizenship &amp; Immigration Services isn’t to fix the mass illegal immigration crisis. It’s to introduce “a third gender option” on their forms. Can’t make this stuff up.
1,"🇮🇪31/3/2024
🚨 🚨 🚨
“Immigration has positive effects and negative effects, and when it gets to big, big numbers like 250,000 people [in 2022 alone], it has big negative effects”

Explosive stats &amp; straight talking by establishment economist @DanOBrien20 on @RadioBrendanRTE https://t.co/ZYEzSGwWNi"
1,I understand the both of them and other Ghanaian immigrant children now hearing this https://t.co/eVHjxVhbV8
1,Big migrant movement along castle Combe valleys- male Pied Fly this morning along with many Chiffchaff! #wiltsbirds https://t.co/4Bx0rdkoKS
1,"Why are you calling Black Americans traveling within their own country, “immigration?”"
1,An illegal Chinese immigrant was arrested after breaching a U.S. military base in California. We share a look at the growing trend of Chinese tourists ‘getting lost’ at sensitive U.S. military bases. https://t.co/lPbSKoVVeC
1,"For those that believe the “newcomers” are here to do migrant work, I am selling some ocean front property in Arizona for cheap. 🤣 https://t.co/k9gFUl38C5"
1,"Let’s call a spade a spade:
Roderic O’Gorman; 
Minister Responsible for Missing Children,  Child Indoctrination and Flooding Ireland with Illegal Undocumented Migrant Criminals https://t.co/epuSZUX0Gh"
1,💩High IQ 🇺🇸 immigration leadership....
1,"This is disgusting Rishi Sunak wanted to change homeless people £2,500, stop rehousing the illegal immigrant’s and think about the hopeless people and rehouse them instead, British people comes first https://t.co/yjAJxUiVhP"
1,So it is 'toxic' to publish migrant league tables. Why do they assume that this will make UK immigrants look bad? https://t.co/zXeAhjF9Fp
1,"Nope, this is NOT an April Fools Joke

US Citizenship and Immigration Services actually added “other” as a gender option on their forms.

I’m glad we have our priorities in the right place! https://t.co/9ehK9w5PRx"
1,"If it wasn't for social media, immigration to the country would be so much worse.

Now at least we have the Border Management Authority, and Nigerians visas are being turned down on record numbers and ZEP is being challenged.

Let's continue 💪🏿"
1,any group chat with more than 6 members needs well-defined immigration policies
1,"Governing for Australians, Albanese style.  

Lift the immigration rate to unsustainable levels and kick the battler to the curb. 

“A shocking new report has revealed the extent of the homelessness crisis, with multiple groups calling for urgent action.  As the nation grapples… https://t.co/D2PIwJx7cR"
1,"Don’t believe the lie that an influx of illegal immigrants caused Kenyans to be subjected to new immigration rules by the muzungu pieces of shit at various embassies. 

It’s a sponsored narrative intended to sow the seed of xenophobia against your fellow African brothers and… https://t.co/BkLLjoiUul"
1,"You are being censored.

If you use words such as covid, climate scam, lockdowns, gene therapy, Muslim, immigration, vaccine then there is a high chance that if your post starts to get views then you will see a sexbot post something about body parts in bio. 

As soon as that…"
1,Outrage in Boston: Veterans' Housing Repurposed for Migrant Shelter Amid Crisis https://t.co/DSo27HUHVy
1,"Group of gun-toting migrant squatters busted in Bronx basement apartment on weapons, drug charges https://t.co/ViMziwhUNt https://t.co/6TNZFoyq8J"
1,"A Haitian illegal migrant confessed to s—xually abusing a 10-year-old in Broward County, Fla. Nivenson Sarazin was charged with 5 counts of battery contact with bodily fluids, 5 counts of s—xual assault of a victim under 12 &amp; many other child s—x crimes. https://t.co/pMgAPVW2G6"
1,"I’m being so serious….

Yall didn’t know about the great migration????"
1,Make no mistake. It really isn't safe to vote #Labour.  You can't trust Labour with immigration. If you vote Labour they will give away UK citizenship to the world and his wife. #JoinUKIP https://t.co/AAs4MY3i8q
1,Brave Spanish patriots educate the illegal African immigrant who threatens them with a 20cm knife. Education is important. https://t.co/022IirTJPK
1,"A judge just ordered the mass release of the migrant rioters who stormed our border. 

Will lawfare pave the way for replacement migration?

.@HarrisonHSmith covers this top story and more on today’s edition of the Daily Dispatch: https://t.co/Ibk6ep8xUy"
1,"“Gracie Martinez is a 52-year-old Hispanic small business owner from Eagle Pass, Texas… Martinez said she once voted for former President Barack Obama and is still a Democrat, but now backs Trump — mainly because of the border.”

https://t.co/KtUuz95GaP"
1,"Why we won't vote for a United Ireland.

Higher Cost of Living
Lower Standard of Living
Poverty 35% can't afford basics work
2nd highest on Low pay OECD
Rents CRISIS
Housing CRISIS
Immigration CRISIS
Health Care PRICE"
1,You are a yt immigrant. Stop speaking on Black American culture you uneducated swine.
