is_in_other_df,body
1,"Sarah Sanders Deploys Arkansas National Guard to Southern Border to deal with illegal immigration.

Do you Agree?
Yes or No https://t.co/QwXDqF4RMw"
1,"Pro-legal immigration. Pro-Ukraine. Pro-American leadership. 

Be a badass conservative, like this guy... https://t.co/CLktHSMtdU"
1,"Malawians and Nigerians can relate with this US illegal immigrant.

Illegal immigration is the only crime the perpetrators are unapologetic about their crime and and rub their crime in our face.

Their entitlement is universal. https://t.co/aCDFTQU5SN"
1,Watching non Southern Black folks learn about the great migration in real time  is kinda sending me
1,What happened to Riad Bouchaker the migrant who stabbed the children in Dublin not a peep about it. https://t.co/I6YHXwsv7p
1,"Chicago residents are fed up with the migrant crisis!
Here they are at the city council meeting chanting ‘Go red’ and ‘No more blue, no matter who’. 
Welcome aboard! 🙌🙏🇺🇸 https://t.co/yAZXMRekNI"
1,"A bad day for vindictive hobbit @NileGardiner and mouth breathing royalist not so secretly pining for their prince to leave that black woman and return to the UK.
The Heritage Foundation’s flimsy case is built on the argument that Americans “deserve” to see Harry’s immigration… https://t.co/8U6SSebdiN"
1,Tethers discovered the “great migration” and are trying to use it as a gimme gotcha https://t.co/xifbW5MdAr
1,Stop mass immigration immediately.
1,"@OrdinaryGamers When was the last time you have been to any country in Europe that has had a massive muslim migrant influx?

If you didn't live a sheltered upper crust lifestyle maybe you wouldn't jump immediately to racism when presented with something you are uncomfortable with. https://t.co/UwZ3N3917D"
1,"In this season of rebirth, may you feel your faith renewed and your heart made new with the hope Easter brings.” “Happy Resurrection day from us to yours.#Theuntoldquests https://t.co/LBMz0ccPMf"
1,"A recent ruling by a federal judge in Illinois allows an illegal immigrant to carry firearms.

This ruling sets a perilous precedent that must be overturned to protect the safety and well-being of American citizens.

Learn more:

https://t.co/mEz0DAuUwY https://t.co/4KHq9zyglh"
1,"Mass migration is being forced on Ireland against the wishes of its people. In this interview extract, Michael Leahy, candidate for Ireland South in the EU election, looks at what is driving this and the potential fore social dislocation which it represents. Full interview to… https://t.co/FPxQaBMkO1"
1,"No one should hire this kid. Not necessarily for any ideological reason but he’d be insufferable in an office setting. Irritating college grads are an under appreciated force behind mass immigration, legal or otherwise. College is a scam. https://t.co/sD8HbkzZSO"
1,The immigrant league: https://t.co/GaFPq1RR8P
1,Migrant gets in Swiss Nationalists face and learns not to do that again. https://t.co/Q9Gaj3QHZ1
1,Hmmmm.....another 'mainly peaceful' immigrant? https://t.co/SBkhq8nbbM
1,No tenure and a &lt;$60k a year salary in 2013 to winning the Nobel Prize in 2023. Yet another immigrant who struggled substantially with American immigration law and yet revolutionized the world.
1,"Illegal migrant Muslims attacked with  stones and bricks on GHMC WORKERS( Dalits) in Hyderabad. 

Ghmc workers daily routine work to remove illegal shops on the road.

Still no action on them. 

#HindusUnderAttack #DalitLivesMatter https://t.co/SqPrAjJ7Da"
1,Vitaly catches an illegal Immigrant child predator and shaves his head 🤣🤣💀 https://t.co/gc2sapUprC
1,"Falling birth rates. 

Highest immigration.

It’s a fact the irish are being replaced. 

#IrelandBelongsToTheIrish https://t.co/SdXd4u8Q4U"
1,"Update  ❗❗❗
#Pi Wallet is now on https://t.co/HoNESpe5zS, as part of the domain migration of Pi apps discussed in the Pi Day announcement. The previous wallet.pi URL will no longer work and will redirect to https://t.co/HoNESpe5zS. The domain migration helps keep the domain… https://t.co/ynxumkbMqt"
1,"🚨Chicago woman is NOT HAPPY about the migrant crisis in her city and the news that the Measles is spreading. (Warning Explicit Language)
POINTS SHE MAKES: 
📌Chicago is having a an issue right now with the migrant crisis.
📌The migrants have been waiting for the money they've… https://t.co/LplW1QXSRU"
1,"I need you Lord — Nigerian lady weeps profusely while on a bus over her struggles as an immigrant in the U.K.

📹: iamoyin05 https://t.co/NWuD8I0cVT"
1,"NYC Migrant From Ecuador:

""This country has now collected all the garbage that comes from other countries""

""There are many people coming to do evil""

""Many people with bad backgrounds""

Why don't the leftists see what's going on?

Credit: @nickshirleyy 

🚨🚨🚨 https://t.co/x2osVHXIs0"
1,"Shocking graph in the Telegraph.

Highest violent crime conviction rates in Denmark from 2010-2021, by nation of origin.

Uncontrolled mass immigration has FAILED. https://t.co/guhSbhC0V3"
1,"Paid my immigration fees with lightning, worked like a charm. https://t.co/YmD4PvwD4L"
1,"Coolock 📍🇮🇪

Concerned Irish citizens out protesting our government forcing illegal Migrant plantations in our communities. 

#IrelandisFull #IrelandOptsOut 

 https://t.co/IKzt3uAbQN"
0,"They have to go back. They can't even throw a punch like a man, lol.  Mass deporting them will be easy. #India #Immigration https://t.co/tssdAnxuNc"
1,It's not a housing crisis It's an unlimited immigration one https://t.co/iIATsPQUAu https://t.co/AIhk6ozaWz
0,"Third World ‘diversity’ on display in London… they call this a ‘strength’? 
Make London British Again.
Vote ‘Britain First - No to immigration’ in the London Mayor and Assembly elections. https://t.co/ZtsLwhIdc3"
1,"Immigrant who wanted to travel without ticket meets the wrong german 😂😂
FAFO

https://t.co/KwpYiQMslx"
1,Barack Obama on immigration in 2009. https://t.co/uykpc1nCxb
1,"I’m sick of these politicians and journalists jumping on board now claiming immigration is out of control now it the number 1 topic for voters.

We’ve all been saying this for well over year and we’re labelled every name under the sun .  

Last year Peadar Toibin was saying “we… https://t.co/ClZFGaBCYU"
1,"European Union migration chief Ylva Johansson says, “Without migration, we will starve.”

Johansson then goes on to say the working-age population in the EU will decrease by 1 million per year. Her proposed solution? Citizens will be replaced with 1 million immigrants per year. https://t.co/lupQUy4qyK"
0,"I look upon @KonstantinKisin as a real, old school liberal. No doubt with his book ""An Immigrant's Love Letter To The West"" &amp; this speech on why immigration is bad will probably get him smeared as far-right. 

He points out in the first 11 years of Tony Blair more immigrants… https://t.co/ORewii8ykk"
1,"Hello OverProtocol Community 👋 

Extract from the Over Network AMA

🔹️The Maximum Supply is 1 billion.
🔹️KYC will happen during Mainnet Migration. 
🔹️KYC Update will be released.
🔹️Over has it's own Network.

🔶️Follow @Over_Node 
🔶️Follow @JAROLA_7 
🔶️Repost this… https://t.co/48p5g4pD44"
1,"I don't know why people are just now freaking out about immigration... It's been happening at a breakneck speed for awhile now.
Oh, it's because the new ones aren't legal? I see no difference https://t.co/dIPYaCBOrx"
1,"Footage from outside the International Protection Office in Dublin tonight. 

The migrant camp has now expanded onto another street. https://t.co/3Tz5GDQmGr"
1,Switzerland: A migrant attacks a couple of Swiss Nationals. https://t.co/ip1wgiB0F3
1,"The Irish have returned to our rebellious ways. 

Join us as we say no to mass immigration! https://t.co/BQEtO0T7P3"
1,Time for the Irish to rise against this government and mass migration.. our country is suffering… our heritage is suffering… let’s get off our asses and show the government we the people are fed up… it’s time for Eire to rise 💚🤍🧡 https://t.co/3Gxkq3r5UT
1,"🚨 US🇺🇸 

A boy was beaten in broad daylight in Washington DC by two immigrant men armed with pistols and automatic rifles. https://t.co/qWCCadk1mc"
1,"Never once did we have a conversation about legal migration because the Prime Minister didn't want to talk about it.'

Former Immigration Minister, Robert Jenrick, reveals that despite fortnightly meetings with Rishi Sunak, the PM was not interested in discussing migration. https://t.co/w10jtCJTp6"
1,"Ireland doesn’t want to to be in some EU migration pact 

We want to be sovereign and independent. 

#IrelandOptsOut https://t.co/QLiFaC0d1x"
1,"I'm a father, husband, immigrant, North Minneapolis community leader, lifelong Democrat, and proud American. I'm running to unseat Rep. Ilhan Omar because, like many Americans, I'm sick and tired of the division and dysfunction that stalls needed progress in Washington. https://t.co/TDdWDBL4Fy"
1,"If you want to see what a real threat to social cohesion looks like, this is it..our Government is normalising&amp; actively facilitating mass immigration. Is there anyone left in Government with a thought for the ordinary man, woman&amp;child of this country? - Generational Betrayal https://t.co/lWjyhlD4au"
1,"Hey Stephen Colbert, 

We haven’t heard you talk about missing migrant children in almost four years.

Surely you asked Biden about them last night right? https://t.co/MVft2Uo3ma"
1,"We have 2 weeks to make as much noise as possible about the EU Migration pact 

We’ve pushed the government back with #VoteNoNo and #BinTheBill 

Let’s go again and tell them #IrelandOptsOut https://t.co/9CpveeWVf5"
1,"We Are Stand With Texas
No Illegal Immigration
No Traitors https://t.co/xRlKLyWqyh"
1,"Happy Easter everyone. 

Ireland must opt out of the EU Migration pact. 

#IrelandOptsOut https://t.co/8BeSkMoC1i"
0,Immigration is turning Ireland into a shithole..!
1,"Japanese police raided the headquarters of a far-left group called Chūkaku-ha. They're a known communist and pro-immigrant group. Multiple members were recently involved in violent protests and were arrested by authorities.

Some Japanese politicians support immigration, however,… https://t.co/No9AZ61niD"
1,"&gt;Pro population growth
&gt;Anti-immigration 
🤡 https://t.co/weLP8DXajS"
0,"Mass uncontrolled migration of men coming from countries with different values to ours ,and especially their misogyny towards white females,has,and is destroying the UK https://t.co/Svc5cqfuCw"
1,Map of the extent of Austronesian Migration - Made by me https://t.co/Z6zPMmbmqZ
1,".
Road Rage in Brampton, ON 
.
@PeelPolice you seen this one 
.
Mass Immigration Needs To Stop https://t.co/lC8yP1O0bj"
0,"""Immigration is a privilege, not a right, and the safety of our citizens must come first, without question.""
~ President Donald J. Trump https://t.co/VQXrIPWYbM"
1,"🇬🇧A migrant brutally beat an Englishman for asking him not to smoke marijuana on public transport in London.

I don't understand what the English want from these good people.?🤷😅 https://t.co/G77lXfqKTY"
1,This woman's political career ends if she signs Ireland up for the new EU migration scam. #IrelandOptsOut https://t.co/PTyfPKK5tm
1,"🇨🇦Want to see the PQ absolutely shred Trudeau on immigration policy, housing and Provincial Overreach?🤔

Here you go! 🔥

“Liberals incompetence and policies created the housing crisis” 

“They don’t give a $&amp;!?” https://t.co/qqJDK1ZY7J"
1,"3/26: USBP agents in El Paso, TX arrested an illegal migrant from Venezuela with a warrant out of Fort Worth, TX for Theft of a Firearm &amp; Tampering with Evidence. 

He will now be extradited to face charges. https://t.co/Txg6GOhqf6"
0,I predicted the migrant invasion in 2011 #LiberiAmerica https://t.co/qSNAwEi7nY
1,Return to White only immigration https://t.co/7kzvhcZACD
0,Freeloading migrant influencer mocks US taxpayers who 'work like slaves' while waving cash in latest videos https://t.co/SL31DcsiJk
0,"🇮🇪 UNVETTED MIGRANT SONG. 
TAKING OVER IRELAND. MAKE IRELAND BLACK AGAIN!! ✊🏾🇮🇪
https://t.co/Tvo4m4fAIl

#IrelandBelongsToTheIrish #Ireland #Irishfreedom #irish #IrelandOptsOut #migrants #kannonsound #kannon https://t.co/HApX53tUFj"
0,"A Venezuelan illegal immigrant who went viral on TikTok urging people to squat in U.S. homes has been arrested by immigration authorities.

Do you feel bad for him? https://t.co/HkA7RoeMVv"
0,"Gujarat High Court | 28/03/2024 :: Shah Rukh Khan starrer Dunki gets a special mention from the Chief Justice Sunita Agarwal in the discussion of 9 missing people who had purportedly taken the illegal immigration route. 
#ShahRukhKhan https://t.co/ZqtL4HEnms"
0,"10 days after arriving in the UK, this migrant attempted to meet what he thought was a 13 year old girl. https://t.co/inOTHsGcpN"
0,"Immigration into Denmark 2024 

110 highly educated and highly skilled people. 

These are more sensible levels. 

#IrelandOptsOut #IrelandisFull https://t.co/2xdpZEoiJy"
0,The plight of poor migrant workers from Bengal. They are branded as Bangladeshis and tortured in the neighboring state of Odisha. It is @mamataofficial who stood by those victims of divisive politics. https://t.co/5vo7rVIVRG
1,We all need spring migration https://t.co/b3W0sSRoWK
1,"A group of migrant parents teach their young children how to steal food from a European supermarket. 

The parents, remove products off the shelves and eat them without paying- giving their children stolen ice creams. 

 https://t.co/yxI7PpojzS"
1,"When local law enforcement agencies arrest an illegal immigrant, they should work with federal immigration officials and keep our communities safe.

That's why I introduced a plan to ban sanctuary cities and counties in Michigan. https://t.co/6U5uByRZvw"
1,£400 a night luxury hotel given over to housing illegal immigrant scroungers.  Unbelievable 😡 https://t.co/P7UMjuProm
1,The Irish Government and @fiannafailparty have no right to destroy the Ireland that men and women fought for in #1916 People didn't die for Ireland to become the shitty migrant colony of Europe. #IrelandOptsOut of the migration pact just like Denmark and TDs must vote no. https://t.co/zLpTkEfCMn
1,"Humza 'Son of the Soil of Pakistan' Yousaf Vs Humza 'Glasgow boy' Yousaf.

Shortly after becoming FM, Humza made it a personal objective to increase funding to Pakistan &amp; immigration from Pakistan. He also mentions how excited he is to visit the motherland &amp; fatherland as a proud… https://t.co/NbZzbjCAAc"
1,With immigrant parents is even crazier
1,"Chants of ‘Get them out!’ at a patriotic protest against illegal immigration in Ireland. 
These Irish youth are awake, not woke! https://t.co/Qp5Zp9C6nY"
1,"Elon is an immigrant. 
He’s is a danger to America, sprouting off conspiracy about immigration. 
The U.S government needs to cancel his contracts. https://t.co/0dHrvdVRBj"
0,"Remember this guy?

MIGRANT INVADER that ENCOURAGED others to INVADE HOMES in America LAUGHS at HARD WORKING Americans as he BOASTS about REAPING OUR TAXPAYER DOLLARS for DOING NOTHING

Says he'll NEVER EVEN ATTEMPT to get a JOB because it PAYS MORE NOT TO! https://t.co/9torukWB5v"
0,"#COWBOYCARTER my grandparents were a part of the great migration into Chicago. They never once let us forget the country roots: MS, AR, LA, AL. They wore cowboy hats, boots, n loved Muddy Waters l. I am them. They are me. Let’s reclaim what’s ours https://t.co/EyNbRE2nKi"
0,"Voters say President Trump has the better policies on SEVEN of their TOP 10 most important issues:

IMMIGRATION: Trump +48
TAXES: Trump +32
OVERALL ECONOMY: Trump +30
CHINA: Trump +28
CRIME: Trump +28
INFLATION: Trump +27
MIDDLE CLASS: Trump +5

 https://t.co/krDCC42gmr"
1,"The Irish people refuse to have others speak on our behalf. 🇮🇪

We must reject the EU migration pact. Our nation’s identity and security are non-negotiable. 

Let’s prioritize our citizens welfare and safeguard our borders.

#IrelandOptsOut #IrelandIsFull https://t.co/PsWPkm5p9M"
0,"You shouldn’t be able to fly to Mexico from any country on earth and then walk to the US border and claim “asylum”.

That’s not how it is supposed to work.

The word asylum is supposed to mean something.

Economic migration is not asylum."
0,"Disgusting African migrant attempted to attack people with a knife in Spain. Spaniards’ fatigue reaches breaking point and they deal with the situation before he can harm anyone.

We shouldn’t have to live like this. https://t.co/FjXDnBG8y6"
0,Is Biden just too stupid to realize how illegal immigration is destroying our quality of life?
0,Chinese National and Illegal Immigrant Found on California USMC Military Base https://t.co/Ry9jduqqqG
0,"Without immigration and migration Ireland becomes static and cuts itself off from the rest of the world, a bit like North Korea if they fancy a bit of it…This is as base level cretinous thought processing as it gets… https://t.co/v41DO1Dq5z"
0,"If an illegal immigrant can own a firearm, then so can anyone with a dubious criminal record. What that federal judge is basically saying is it’s an utter free for all and they know damn well that background checks and the entire system we use to “regulate” guns is pointless and…"
0,"🪪 The situation in the Sakharovo migration center in Moscow: there, citizens of foreign countries receive, among other things, work patents and temporary residence permits.

📍follow for local Moscow content from people who actually live in Moscow

The reason for the crowds here… https://t.co/NJYbr43aHv"
0,"BREAKING: Venezuelan migrant Leonel Moreno is FINALLY arrested by ICE in Ohio after sparking fury with TikTok videos sharing squatting tips on how to invade homes.

He was picked up by ICE in Columbus, Ohio and is now in federal custody 😂 

https://t.co/tuyau2mNh7"
1,This is how immigration and diversity enriches us. https://t.co/8z1TkzHRFW
1,"This is why Ireland needs to opt out of the EU migration pact. 

It will be the death of our nation. 

#IrelandOptsOut https://t.co/wcbteGwO17"
1,Feral African migrant causes accident in France and then goes on violent rage against other commuters and even police.   https://t.co/AJXe4AvuXW
1,"Hiroshi Shimizu's ""Arigatô-san (1936)"" was shot entirely on location. This scene featuring a young Korean woman which serves as a microcosm of the plight of migrant Korean labourers in pre-war Japan, was decided to be shot when Shimizu accidentally met them during filming. https://t.co/USJXbrPEF2"
0,"Instead of halting immigration, let’s import more people to build houses so we can import more people to live in them. 

Genius. https://t.co/Bst8j40wAw"
0,"NEW: Illegal who skipped on ICE is now saying everyone envies him because they ‘work like slaves’

“You’re hurt because I make more than you without much work while you work like slaves, understand?”

Local and immigration authorities say they are unaware of Moreno’s current… https://t.co/gFEBWduegX"
0,Illegal African migrant threatens Spanish natives with knife and finds out there is testosterone and patriotism as they beat him without mercy.   https://t.co/JzFYn2dRQv
0,"Do you support Elon Musk saying the Biden Administration is actively aiding illegal immigration?

YES or NO? https://t.co/mcQc0Hmoi9"
0,Freeloading migrant mocks US taxpayers who 'work like slaves' while flexing cash in his latest videos | He committed a felony by giving immigrants advice on how to break into U.S homes &amp; “legally” becoming a squatter. His TikTok with 500K followers was recently shut down https://t.co/5IxziGaeGR
0,"🇪🇺🚨🇮🇪

Poll: Next-to-Zero European voters think that politicians are doing a good job on illegal immigration

Just 16% of votes believe that EU leaders are doing a good job on handling illegal migration 

#IrelandisFull https://t.co/WRoEMVuZLx"
0,"Social cohesion won’t last until 2035.

If we don’t start taking urgent action on migration we are going to see societal breakdown.

I don’t want to see that and I will do what I can to prevent it. But it is my base case forecast if we maintain net migration of &gt;500,000 a year. https://t.co/Do0YRWBgrx"
0,"With over 13 thousand votes on our recent poll, over 72% of people believe immigration is a huge election issue. So are we to assume 72% of the voters are right wing? 
Politicians need to grow up and accept there is a problem and stop pandering to NGOs. https://t.co/i116mS1WhX"
0,"A homeless man sleeps on the ground next to the Fresno Democrat Headquarters and the Dems do nothing to help him. If that had been a migrant they would’ve rolled out the red carpet. 

I agree with ⁦⁦@BenBergquam,⁩ “Stop voting for these idiots“ https://t.co/VX7bgxfYM4"
0,"Tamil Nadu: In a major success, UP ATS has nabbed mastermind of Rohingya illegal migration ring, Kafeeluddin from Vellore.

So far UP ATS have arrested Adilur Rehman, Abu Hurera Gazi, Sheikh Nazibullah, Tanya Mandal, Ibrahim Khan, Abu Saleh, Abdul Awwal for helping illegal… https://t.co/fclpDWE3aE"
0,He's from an immigrant family
0,"Breaking Illegal Immigrant Squatter Moreno has been arrested.

He faces immediate deportation back to Venezuela.

 https://t.co/xr22IIZP1B"
0,BREAKING: The “migrant tiktok influencer” who mocked Americans who “work like slaves” and gave tips for squatters to take over Americans’ homes has reportedly just been arrested by ICE in Ohio according to Fox. https://t.co/fudKgLL1CB
0,"“Just this morning today, 4 accused child r*pists and an MS-13 gang member”

“That’s everyday in #Boston”

The lasting effects of uncontrolled, mass immigration on Americans are plainly obvious and have been well-documented throughout our country’s history. #Democrats own this,… https://t.co/5kaJxP5S28"
0,"It has been revealed that, as part of Agenda 2030, the UN is funding the mass illegal immigration of millions of people into the US, Canada and Western Europe—providing illegal migrants with debit cards, cash handouts, food, shelter and ""humanitarian transportation"". https://t.co/OBQJ9HXNo8"
1,Moore Street Dublin today and pre mass immigration. https://t.co/hr9hE1Fxzb
1,"""We are eroding our Sovereignty"" Mattie McGrath TD on why he will be voting against opting in to the EU Migration and Asylum Pact.

Barry Andrews MEP deliberately fails to mention Denmark the only other EU country apart from Ireland that has the right to opt out of EU immigration… https://t.co/Ed3InUOu8f"
1,"Squatting is terrible in America, but watch what it looks like in Barcelona

There, in the very anti-gun, anti-self-defense Europe, an illegal immigrant from Africa took over a Barcelona man's home. When the man tried to get the illegal immigrant to leave, he was chased away with… https://t.co/zdhRCOWObe"
1,"Every single person living in the UK should be afraid..very afraid

Multiculturalism &amp; the mass migration of men coming from countries with different values to ours, &amp; especially their misogyny towards white females, has, &amp; is destroying the UK. 

 https://t.co/RBM7e4ma9M"
0,"As a LEGAL immigrant, 
I see #BidensAmerica  —flooding our country with illegals —
as an injustice.

Illegals don’t gaf about America other than FREE stuff.

America FIRST❗️ https://t.co/dcfTewjj2g"
0,".@muckraker journalist, Anthony Rubin, takes Primetime inside New York’s infamous migrant tent city where illegals get ID's, welfare and the hottest tech. https://t.co/36pGP4rUb4"
0,"South Dublin says no to mass immigration ,Ireland 🇮🇪 https://t.co/Y7nnKIcyR5"
0,"OPEN BORDERS NIGHTMARE:  Stunning video by immigration correspondent @Oscarelblue shows “caravan of 3000 migrants leaving the south of Mexico to the USA.""

The New York Post reports that the caravan expected to reach El Paso in the next few days.
https://t.co/pETuq4uUhm"
0,"A message for the @RNLI taxi service, Border Force traitors &amp; all illegal immigrant criminals, you’re NOT WELCOME! 😡
Turn your boats around &amp; bugger off back to France! 
Share if you agree!
#Britain4Brits @RishiSunak @JamesCleverly https://t.co/egxoKAKX3P"
0,"Immigrants are &amp; have always been the fabric of this country. I wonder if this segment can change minds — take note how your ancestors were received by America and discover a sense newly found empathy? 

“This country was literally built by unwilling and willing migrant hands,… https://t.co/ZS2nTrTc6a"
0,"If you are better off today than you were 4 years ago, you are highly likely to be an illegal immigrant or a politician."
0,Fast forward to Ireland 2040 after the Irish Government and the @fiannafailparty destroyed Ireland by enforcing the unwanted EU migration pact.... You have 2 weeks to send a message to FF that #IrelandOptsOut and they need to vote no... https://t.co/oPE8QjXQQ7
0,"Thousands of migrants set to arrive in massive, El Paso-bound caravan in just a few days 🔥

‼️A new, 2,000-person migrant caravan is making its way north to the US border — and is expected to reach El Paso, Texas, in just the next few days.

Source (https://t.co/Uo7ASNqylp) https://t.co/c8sVm0UXXa"
0,A monarch butterfly taking a break on a milkweed plant!   This vital partnership helps fuel their incredible migration journey. #nature #photography https://t.co/6PTgFgKA2C
0,"James Lindsay explains the Cloward-Piven strategy to Joe Rogan. 

This sounds alot like what going in Ireland with the “migrant crisis” 

#IrelandOptsOut 

 https://t.co/3spCnYMdaN"
