is_in_other_df,body
1,I recall domestic terror attack on an immigration center where the attacker used the exact same rhetoric as AOC uses
0,French police accused of 'endangering' lives after boats ram migrant dinghies in Channel - Latest From ITV News.    AND? What’s the problem? Did they sink any?  https://t.co/NocMXg0qOm
1,"In the glorious fight against #Corruption honest PM @narendramodi has successfully inducted the most honest, migrant? businessman of Karnataka, former BJP leader, one of the god children of late BJP leader SushmaSwaraj back to BJP. 
Thus fight against corruption is completed"
1,PRO PUBLICA REPORTER: “So many farmers tell me their businesses would collapse without migrant workers… off the record they admit to hiring undocumented workers… they say they can’t hire 🇺🇸-born workers to do this work.” https://t.co/m2wmB44HIM https://t.co/09iNJO2aW3
1,"Invasion is not immigration. Illegal immigration is super high crime. That's a lie you push. 37% in prison for drug crimes are illegals. High rate of drunk driving deaths are from illegals. If migrants are Democrats, that does enlarge a group, that does well over 90% of felonies."
1,Yep. It’s simply a matter of enforcing existing immigration laws. That he doesn’t is an impeachable offense! https://t.co/2Lctm9HPSz
1,"There is a big difference between a “broken immigration system” (as Democrats say) and a “secure border” (as Republicans say)

An immigration system lets people in, a secure border protects the country from keeping people out who don’t come in legally"
1,"@Thee_Real_Miki @DiazAndytwelve1 Lolol...yeah, u can tell u live in a migrant zone somewhere😆 As I said, Black AMERICAN hoods are fine for the MOST part. Where all you migrants live tho,....thats a different story altogether🤣 Your Haitian neighborhoods might need some work. I wish u well in fixing them dumps https://t.co/TQtXohNTmf"
1,@zarahussain999 The immediate solution is no more Muslim immigration and deport all those who consider their faith is more important than anything else😘😘
1,"@think_or_swim @thisweekrte High taxes, pro-abortion, one of the highest immigration rates in Europe, policing people's speech, big state, ever-increasing regulations...... And FG are ""already well to the right""? Good luck with that one."
0,"Spring migration in full swing now. Two Viz-Mig Great White Egrets were my first of the year. A climate change beneficiary, they are still a decent scarce species here, but increasing rapidly year on year. Always nice to find though. @PhoneSkope @SwarovskiOptik #birding #finland https://t.co/u6qn4xLTeE"
1,"When DHS releases a migrant, they still need to get to their ultimate destination. Many buy bus tickets, and many buy plane tickets.

But since DHS confiscates ID at the border, over the last decade (yes, this happened under Trump too), TSA has found alternate ways to check ID."
1,"Canada🇨🇦 has always heavily relied on immigration to boost its economy.

However, worker productivity has seen a decline.

It is important that targets are set and those targets are reached.

This is only a decrease in temporary residents so the housing🏘️🏗️ market can keep up."
1,"Happy Sunday!!  Many thanks to all who took part in #EarthHour!  Remember to please commit to a migration outside Lights Out at 11pm habit!  Thanks everyone!  

Let’s keep the North American birds on course together!💕"
1,@AngelManufact Argentina literally is becoming a Turd world alien regime under milei though. He promotes peruvians street peddling goods and immigration.
1,"Texas busing company to halt migrant transports to New York City

Lawsuit alleges bus companies are illegally finding their way around an executive order restricting the relocations.

Read more ⬇️
https://t.co/luYh7euHAZ"
1,"@SenatorTester ""You are a shameless fraud. You voted AGAINST amendments to deport criminal aliens, to stop Biden’s secret migrant flights, to stop Biden’s mass releases, and to stop sanctuary cities. You eagerly voted to perpetuate the invasion. You are waging war against Montana."""
1,"@caringguy1957 @RepMTG The bills wording allowed for 5k illegals from contiguous countries only, hence Mexico and Canada, to be included in the count. It did not count any illegals from other countries. It also allowed for unlimited numbers of minors, however, minors through the immigration law are…"
1,"My SO in Denmark with a Hong Kong passport was (begrudgingly) required in the immigration process to select ""China"" as nationality, birthplace, passport issuer etc. In fairness, it is a SAR in China, for better or worse.

But Taiwan is demonstratively a sovereign nation, period."
1,"@cootiesvaccine Am I the only one who remembers the mission where he beats up a Polish immigrant, insults him, and robs him?"
1,"Thank you @NHCSL for an informative and helpful Spring Executive Committee and BBA meeting.  Great discussions on the economy, immigration, health equity and media issues. #KnowledgeIsPower https://t.co/eC1FzNoA9D"
1,"@Klaus_Arminius @Bleakhouse12 Instead of spending billion on migrant men put the money into childcare, longer maternity leave. I think there’s a plot to slow down the birth rate in Africa by bringing them here. It’s plausible, remove the men slows down the 14.2 children per adult in Niger. What you think?"
1,"@AJManaseer What we need is a real United States Attorney for the Northern district of Illinois 
Not one appointed by the current federal administration
When they discover the complicit fraud between state, county and local government and the local teachers union and the migrant situation…"
1,"Ireland must NEVER sign up to the WHO or IHRs, which affects every aspect of our life including health, climate, immigration, education and farming! 

There hasn’t even been a look back on the Covid carnage.  Never forget what this Irish government did to the most vulnerable 👇👇…"
1,"We're winning. Scrap the hate speech!

A move away from left wing politics will remove DEI, LGBT indoctrination in schools and medical institutions, and cease mass immigration.

Ireland is healing!"
1,@Slatzism I agree that this is bad but this more of a immigration issue than an Uber issue. Illegal Venezuelans wouldn't here in the first place if the government didn't encourage them.
1,"⚡️Disinfolklore’s Witch Switch

So this migrant othering works like a dream in triggering our desires to be in the Inner Realm. 100% guarantee! Here’s how modern far-right witches switch our witch switches.

There is another aspect to populist politicians attempting to capture… https://t.co/Yddnl88hZq"
1,"This isn’t evidence of a “broken immigration system,” it’s an invasion this administration is allowing and welcoming. Vote them out."
1,"@Tony40335450 So let me get this right, I guy was just minding his own business and then gets killed by a migrant our government let in, #Labour #Conservative"
0,"3am was hard to find a taxi to take me to the airport cuz Ubers are not a thing here. Living in SF it didn’t even cross my mind that this could be a possibility. 

Was hard to find a cab, until I find this driver. He’s an immigrant, he comes from the Philippines and he is a…"
1,"@JuddLegum @Igotquesti88413 @overitall69 @elonmusk So this is  regular SPONSORED immigration, probably family of people already here."
1,ThePrayerTalk Organization is culminating Women's History Month with a vibrant cultural celebration and tribute to the strengths and resilience of immigrant and refugee women. https://t.co/I9IFbzuxLB
1,"The answer to this is to have more money coming in from current taxpayers to fund current pensioners. Which means either higher tax for everyone; higher immigration but only for higher earners: or force more non-workers into the workplace.

Which is Tricia in favour of?"
1,"There’s also quite a few people who seem to think Ontario’s current, very English flag represents the province’s ‘history’, when Indigenous voices have been here forever and the French predate the Loyalist migration by at least 100 years."
1,"Of course, many don’t have formal IDs. Even if they brought their passport with them when they crossed the border, DHS confiscates passports to use for possible future deportation purposes. So when a migrant shows up with only DHS paperwork, TSA uses DHS info to verify identity."
1,"@moomintroll41 It will be a nefarious suggestion. Once here, Yousaf will fight for them to stay and vote for him to consolidate his power. It's the only reason why the left fight for mass immigration."
1,".@MassDOT Secretary Monica Tibbits-Nutt is our guest today on OTR with @EdWCVB and @bensimmoneau. @GrayMediaGroup and I discuss #OHSenate race, @JoeBiden and Trump fundraising, #SCOTUS TX ruling, #Immigration and more. Please join us 11 AM @WCVB! #mapoli #Election2024 #wcvb"
1,"@KarlLeech13 @RishiSunak @Conservatives A wasted vote was mine for the Tories in 2019. Promised a real Brexit. Points based immigration, a clampdown on crime and a bustling economy. 
Instead we got a half-arsed Brexit, stagnant growth and an invasion of violent religious savages from the developing World.
#ReformUK"
1,"LiA update:

The server migration (necessitated by some underlying site issues) is taking longer than I want it to. All I can to is thank you for your patience and apologize for the downtime."
1,@TopDastan @SkyNews Poor “migrant “ with a phone to record the event. I don’t see what’s wrong
1,@InezFeltscher Read first clause and instinctively thought point would be to tell us to tone down rhetoric on illegal immigration for sake of the female vote…
1,""" The land owners have relinquished interest in the land. The tenant farmers have no stakes in the land per se. Add to that, the aspirational out migration of the youngsters from the agriculture and the village. All these cut off the chord between the land and person.... (2/3)"
0,@JyotiKarma7 outside india migration to better places is on the anvils very soon if Hindu persecution is unchecked
1,"Video appears to show authorities circle migrant dinghy causing waves to flood it.

https://t.co/SZciSyfAcl https://t.co/TnXh193fxX"
1,ActionSA will secure borders and put an end to illegal immigration. https://t.co/ZGF9pk4Ynw
1,"Democrats voting for more illegal immigration

Again"
1,"Who should I support when the country has unlimited illegal immigration, biological men in women's sports and bathrooms, rampant reverse discrimination due to DEI, forcing EVs on people who don't want them, terrible foreign policy, higher taxes, income redistribution, and more…"
1,"PRESIDENT TRUMP - Mar 24, 2024, 6:25 AM.
@MonicaCrowley:  “Donald Trump essentially had the border and illegal immigration solved  in the four years that he was president. In the three years that we  have had Joe Biden, it has been an absolute, historic catastrophe at the… https://t.co/suKLGaQGyr"
1,"Of course, you speak like a real estate developer, not an urban planner. We excuse you for that. If rural-urban migration still eyes Nairobi, then devolution yielded nothing. Horizontal expansion - enlarging the metropolis - is superior to skyscrapers without basic amenities."
1,"🌟NotSoBreakingNews 🌟 
A founder of
 ""Woke""
according to Christian scripture was a poor, Jewish, middle eastern, man of color, a migrant and an immigrant.
😲 !  Imagine That  ! 😏 https://t.co/Ua1OjFf26N"
1,"@rtenews We're winning. Scrap the hate speech!

A move away from left wing politics will remove DEI, LGBT indoctrination in schools and medical institutions, and cease mass immigration.

Ireland is healing!"
1,"@Nic21121970 Immigration is the main issue by far and always is. A nation can survive a lot, but not replacement migration."
1,"... The joint protection of the European space from illegal Migration and treaties with extra-European nations for repatriation of illegals is realizable more quickly by a united, patriotic Europe than by national solo-efforts."" I'm delighted this realization is... https://t.co/LrvpuvvkLj"
1,@BellaWallerstei @Telegraph Jews who were all in on destroying White western societies with mass migration are now reconsidering because they are being impacted. Disgusting but unsurprising.
1,"Frustrations, Anticipations and, Questions | Canadian Immigration Live Q&amp;A https://t.co/uu9y0Pw5u9"
1,"@FLVoiceNews God forbid these poor people try to find safety and refuge from the chaos they have in their home country, and come here for a better life. Many are willing to work and obey the law, and go through immigration the lawful way.

DeSantis won't even give them a chance."
1,"Hear leading analysts discuss how #climatechange is reshaping mobility patterns on the MPI podcast “Changing Climate, Changing Migration.” Subscribe wherever you get your podcasts

https://t.co/VFWm5yXD09 https://t.co/QTW6SsXJVe"
1,"➡ 1 to 1 Satoshi mapping

Each BTC address has a identical counterpart on SPACE

Both addresses are like virtual twins.

This offers benefits like:

- Safeguarding BTC core design
- Seamless asset migration
- Ecosystem experience BTC

- sCrypt familiar to DEVs"
1,"@TheTNHoller This is typical. Republicans scream about the horrors of illegal immigration, while their donors hire the immigrants and tell them not to stop it."
1,"@michaelmurph_y Excellent documentary Micheal

It's sad that Irish based MSM won't report honestly on what's happening in Ireland around mass immigration"
1,@Brumtownbrawler @SerenaJB3 @LeilaniDowding The effects of mass immigration on the white working class are such that I can't pop to any restaurant whatsoever. If I could I would support a business run by my own people.
1,"@dontbrexitfixit Andrew

our country is very close to coming to an end 

1000 years of England

NHS, pensions and benefits, mass immigration and so on killed it

RIP 🪦"
1,"By incorporating geographical data of sampled genomes, they leveraged the network to infer the probable locations of the predicted common ancestors. The outcomes effectively recapitulated pivotal events in human evolutionary history, such as migration out of Africa."
1,"In the last four years, the Biden administration has violated every historical canon critical to ensuring legal immigration enriches the United States… https://t.co/rVWb3Tez6p"
1,"On today’s episode of there is no link of crime and migration.

The west African man, aged in his 50s, is the leader of the Black Axe gang in Ireland and is public enemy number one for the Garda National Economic Crime Bureau

The Garda National Economic Crime Bureau is now… https://t.co/7H8Siov7gn"
1,The obvious solution to illegal immigration is right before our eyes.. https://t.co/ZGbQSlrqMz
1,"Wise County, TX: Osawaru Johnson was arrested for Criminal Trespass, Fail to ID, and 3 counts of Assault on a Public Servant.

He has an immigration detainer hold. https://t.co/dFcDW1kMai"
1,"This guy. 

Migrant influencer urges TikTok followers to ‘invade’ US homes
https://t.co/xQtRVimhyZ"
1,"Now we no longer have any Labour MPs in Cumbria, we can see investment and a positive future rather than managed decline.

But even from the Lords, Cumbrian Labour peers still try to block our Rwanda plan

Labour don't have a plan for immigration. They won't stop the small boats. https://t.co/0x24ixA6dr"
1,Don't forget the migrant exodus of Covid unplanned lockdown by Modi. Vote wisely India. https://t.co/scf877I7hy
1,"No.1 hit song on Lifeborn 🤿 *not using rhymezone

Opoona is not what I expected. A story about immigration, capitalism, fascism &amp; finding purpose in society which is to WORK. https://t.co/q8XAHW369T"
1,Mizoram fan from Manipur who is an illegal immigrant got disheartened 😭😭
1,I didn't know the extent of illegal migration from Bangladesh to Assam. looks very bad. There has been an explosion of Bangladeshi Muslim population by 30% from 1950-2001. Whereas the indigenous population growth has been at 14%. They're replacing the locals. No wonder the unrest
0,Reward for #Pi validators in upcoming migration.......
1,The @RNLI is an immigrant taxi service. Stop donating/volunteering NOW!
1,"Look at this news article from The Daily Caller: ’She Is Never Here’: Residents Of AOC’s District Blast NYC’s Crime Wave, Migrant Crisis https://t.co/L10y4XQaT0"
1,"“Trump has no clue what the hell he’s talking about when he attacks Latino and immigrant communities. We’re the most diverse country in the world. That’s what makes us strong.” - @POTUS knows the value of an inclusive #CupOfJoe.

#BidenHarris4More
#DemCast 
#DemsUnited https://t.co/UKfGsZJG9D"
1,"In 1918, only 8% of Palestinians were Jewish.

In 1946, even after massive immigration of Jews, Jaffa was the only sub-district with a Jewish majority.

The Nakba was launched to artificially create a Jewish majority in Israel by driving 700,000 Arabs from their homes. https://t.co/AAZDn9mnI3"
1,"The slump in popular support for @sinnfeinireland + @fiannafailparty will continue.  @FineGael is in real trouble.
@labour is facing wipeout as do @greenparty_ie 
Only @NationalPartyIE will stop mass immigration to end the housing crisis.
#TurfThemOut 
#VoteNationalPartyIE"
1,"Tell the truth, you know that people don't understand it because they don't know how F1 cars work, but before the accident you changed the BRAKE MIGRATION and when you brake and block it's your fault, you're trash @GeorgeRussell63"
1,"Need people to understand that these immigration policies are wiping *billions* of pounds from the British economy, starting now.

Not some distant future when immigrants contribute to the economy over the long term.

This autumn will be a terrible reckoning for small uni towns."
0,"Of course, you can't run a game (especially a fully onchain one) on an L1 mainnet.

The Polygon Pathfinder achievement goes to the brave Pirates who bridged their way to the Polygon network, marking the first great migration of the Pirate Nation. https://t.co/YzJWj2QZXB"
1,"@TheEnglishRebel Triple lock is affordable, scrap foreign aid, scrap the EXPENSIVE HoL, reduce the huge numbers of MPs in the HoC, pause/suspend immigration for five years it's too expensive."
1,"GM!

He has a solution for jews.exe, communism, and immigration.

If you have never been to Transylvania you should go and check out his castle. https://t.co/wv3zBSsIhm"
0,"Is Joe worried the illegal immigration issue will cost him the presidency? Doesn’t look like it!

He seems unconcerned with his falling poll numbers too...wonder what the lefties are planning so they ‘win’ this election, again.😉 https://t.co/fjF1PghhfT"
1,Let’s keep it a buck… If you voted for Biden/Harris this illegal immigrant influx that we’re dealing with is your fault
1,Migrant workers banding rose bushes. I always take visitors to the nearby fields of flowers and vegetables to learn what it takes to get items to market. I love living in Arizona USA. https://t.co/sgUrWsW73V
1,"No,and ppl like you are the reason why ppl don’t take genuine concern and advocacy for men seriously

Genuinely caring about the issues that men (all men, men of color, trans men, queer men, immigrant men)is great,but these kind of melodramaticreactionary nonsense is embarrassing"
1,"Replacement Migration is the official policy of the UN.

https://t.co/JxgjPigNSf https://t.co/ysDRn5dENB"
1,"@HelenDodds17 @desertrose1969 @LeDougla @VeritatisCupit3 @CaptPeroxide88 @SeanOfNottm @Lauren_Beleaver We're Europeans, I just don't think it's fair that we have so much immigration from places outside Europe that we are projected to be reduced to half of our homeland. https://t.co/uwh6IoLKKH"
1,"@GarbageHuman23 Nah Europe needs no immigration 
https://t.co/vKZmekJ8tx"
0,"Feds understand that removing barriers to interprovincial labour mobility is good for the economy (let market prices, not governments, allocate labour). Why then give provinces greater control over immigration? Skilled labour markets aren't local. Planned economies don't work."
1,"The legal visiting process in Canada had vaccine requirements.

If that's a lockdown then so is this regime for immigration."
1,@TiceRichard @reformparty_uk no you are being attacked because you caved to a far left ngo in less than 24 hours and expect us all to believe you will somehow beat them to do what you claim to want to do on immigration etc
0,@Mick_O_Keeffe There's a clear direct link between serious crime and migration in Ireland.
1,"@Nic21121970 No problem with immigration providing there is infrastructure and support there for people to actually arrive to Ireland so they may begin contributing to our economy and society in positive ways. Instead, our government is sticking their fingers in their ears, welcoming…"
1,"MANDATORY READING:

* This is the best campaign ad there can be for Trump.

* Moreno is a ""Biden Migrant"" - and stupid enough to have been putting it on Tik Tok, and he got his account banned for it.  

https://t.co/omjSx8qG3H"
1,"On Tuesday, 16 April, the council’s migration team will be holding an expression of interest event for potential Homes for Ukraine hosts.

The information evening will take place in the Forest Café at Time Square from 6.30pm to 7.30pm.

Find out more: https://t.co/QKKvPmR760 https://t.co/D51UkQV7YN"
1,"A new TX immigration law would make it a state crime to cross the Texas-Mexico border between legal entry points, even though immigration enforcement is considered exclusively a federal govt. power. @TheAtlantic’s @ItsCaitlinHD and @AllenOrrEsq join me 10aET to discuss. #Velshi"
0,"@SinnFeen It’s obvious they’ve had a taste of the FFG gravy train politics. The only one who puts up a strong opposition to govt is Pearse Doherty, but even he cannot find the courage to oppose these disastrous migration open doors."
0,EXCLUSIVE: @GregAbbott_TX  told @cbs11jack why he believes the Texas immigration law is constitutional moments after learning the U.S. Supreme Court ruled to temporarily allow it. https://t.co/fnmEyCGDzI https://t.co/ZpmkqpxH2H
0,"I hope this breaks MA. I want my virtue signaling neighbors forced into housing these invaders. Massholes! @HowieCarrShow 
Howie Carr: Massachusetts migrant housing is a suicidal spending spree https://t.co/Y5d5K7Qaio"
0,"@JoeLouis7 @AnitaPadilla32 @illinoispolicy @LindaLeeKing @Jr1Pittman @BobbeBrooks_ @Chicagodecks @theaveragevoter @TheTRiiBE @redbilla @LisaMRomano Withheld certain public records related to the migrant crisis.

Over the course of several months, NBC 5 Investigates has reported on conditions inside migrant shelters"
1,"It's as if the people in charge want to incite so much racial hatred that we're so busy fighting each other that we don't notice that they're turning us all into impoverished serfs on their global plantation....
#Immigration https://t.co/PvdbXsMeAn"
0,"Upset New Yorker speaks about the illegal migrant crisis: 

""Take care of your citizens before the 400,000 people you got from South America"" https://t.co/FqdNjlXhYe"
1,"Nobody on the right will vote for Biden because of immigration.

Nobody on the left will vote for Biden because of genocide.

Biden is relying entirely on the virtue-signalling, myopic liberals in the middle to win a campaign against a populist.

It’s like he wants to lose."
1,"@phil_lyman Examples of
birthright citizenship 🖍️ 
naturalized citizenship 💙
and chain migration ⚪️ https://t.co/GEyisOX79G"
1,"The insane footage of the the migrant stampede at the border that has been shamelessly ripped by accounts here is the amazing journalistic work of @JamesBreeden 

If you are a journalist who wants attribution, watermark your content. Good content will ALWAYS get stolen and…"
1,Make no mistake: London's population explosion is a direct consequence of uncontrolled mass immigration. The government's promises to 'take back control' and reduce numbers to the 'tens of thousands' have proven to be nothing but empty rhetoric #DeportNotSupport #StopTheInvasion
1,"@LondonCommuter8 @Councillorsuzie Susan Hall:
Trump loving
Enoch Powell supporting 
Immigrant bashing
Storytelling grifter
Not in my London https://t.co/j0JNyAeAMA"
1,"One of the most inspiring person I’ve met. 

Serbian immigrant, moved to the US as a teen. 
“I had three jobs before I could even speak English. It’s so easy to make money in America, I was here only 6 months before was able to buy my mom a car and pay for my brother to go to…"
0,"El Paso, TX: ""A migrant from Honduras is a facing felony charge following Thursday's incident where a large group of migrants ran towards the border and breached concertina wire fencing, according to Texas DPS.""

https://t.co/qJp9YEHgNw"
0,Immigration officers at Turnpike Lane @HaringeyAR @AntiRaids https://t.co/f1BRF0klOF
1,"Exaggerating panic through the #Article23 legislation, talking down #HongKong, attacking its status as an international financial center, and scaring off foreign capital and professional migration are part of the new cold war and decoupling strategy of the #US and the West… https://t.co/1aN97BnCSS"
1,"China Behind Super Highway That Targets US With Mass Migration, Economic Warfare https://t.co/4A3xLd5fKp via @epochtimes"
1,"In vacant or in pensive mood
 ""...The honest person forced to memorize Wordsworth's poem about daffodils without having a clue about what the flowers looked like can celebrate spring with the kind of joy that the native born can never know..."" Immigrant, Montana by Amitava Kumar https://t.co/ec0vlPZdG3"
1,"You are a true $VRA legend 

$VRA will proof why it is the $MATIC of this run after POV migration.

Holding my bag tight

No shaking"
1,@NzemaMamy @DaithiDoolan Real change ? More mass migration and plantations !!
